,create_time,text,retweets,favorites,word_tokens,text_clean,polarity,subjectivity,sentiment_2,keywords
195,2020-10-09 21:25:20,Tune in as I deliver remarks from our drive-in event in Las Vegas. https://t.co/wWSWQgfyw6,2846,12931.0,13,tune deliver remarks event las vegas,0.0,0.0,neutral,other
196,2020-10-09 20:05:00,"It’s estimated that nearly another 200,000 Americans could lose their lives by the end of the year because of this… https://t.co/uLcPvW0Hb4",18085,99806.0,20,estimated nearly another americans could lose lives end year,0.1,0.4,positive,other
197,2020-10-09 18:52:00,"Why did Donald Trump tell Bob Woodward the truth about COVID-19, but not the American people?",45574,295094.0,15,donald trump tell bob woodward truth american people,0.0,0.0,neutral,other
198,2020-10-09 18:27:16,"RT @TeamJoe: Are you an extrovert?
Are you an introvert?
Are you an introverted extrovert?
Are you an extroverted introvert?
Are you an  __…",559,106634.55,23,rt teamjoe extrovert introvert introverted extrovert extroverted introvert,0.0,0.0,neutral,other
199,2020-10-09 17:36:12,RT @TheDemocrats: 2️⃣5️⃣ days. There’s no time to waste. Make your voting plan. https://t.co/ZKn8fJEh9z https://t.co/4UfUiv8P5B,1611,106634.55,15,rt thedemocrats 25 days theres time waste make voting plan,-0.2,0.0,negative,other
