,create_time,text,retweets,favorites,word_tokens,text_clean,polarity,subjectivity,sentiment_2,keywords
0,2020-10-22 00:30:00,"Folks, if you plan to vote by mail and haven’t requested your ballot yet, it’s important that you do so as soon as… https://t.co/LlS8JP7Nj4",1181,4677.0,25,folks plan vote mail havent requested ballot yet important soon,0.4,1.0,positive,other
1,2020-10-21 23:50:00,"Vote early.

Vote by mail.

Vote on Election Day.

Just make sure you vote. https://t.co/eoxT07d7QB",2921,19363.0,15,vote early vote mail vote election day make sure vote,0.3,0.5944444444444444,positive,election
2,2020-10-21 23:15:00,"President Trump didn't take the necessary precautions to protect himself and others.

How can we trust him to protect the country?",10607,74966.0,21,president trump take necessary precautions protect others trust protect country,0.0,1.0,neutral,other
3,2020-10-21 21:47:08,I couldn’t be more excited to have my friend @BarackObama hitting the campaign trail. Tune in for his first drive-i… https://t.co/95UA8qjUvt,4454,28721.0,21,couldnt excited friend barackobama hitting campaign trail tune first,0.375,0.5277777777777778,positive,other
4,2020-10-21 21:05:00,It’s time we replace Secretary Betsy DeVos with an actual public school educator — one who values our public school… https://t.co/cy02pEyzXl,14701,84864.0,20,time replace secretary betsy devos actual public school educator one values public school,0.0,0.07777777777777778,neutral,other
5,2020-10-21 20:19:33,Tune in as @BarackObama sits down with community leaders in Philadelphia to talk about what’s at stake in this elec… https://t.co/v4tEMWGHDw,4072,19427.0,21,tune barackobama sits community leaders philadelphia talk whats stake elec,-0.15555555555555559,0.2888888888888889,negative,other
6,2020-10-21 20:05:00,"Hay muchos asuntos que son complicados, pero algunas cosas son visiblemente claras. Las familias deben permanecer u… https://t.co/udd4YrkBG9",1239,6645.0,17,hay muchos asuntos que son complicados pero algunas cosas son visiblemente claras las familias deben permanecer u,0.0,0.0,neutral,other
7,2020-10-21 19:50:00,"There are many issues that are complicated, but some things are just black and white. Families belong together. https://t.co/TgIkhAMAtZ",2858,14500.0,19,many issues complicated things black white families belong together,-0.041666666666666664,0.48333333333333334,negative,other
8,2020-10-21 19:30:24,Cada día parece que descubrimos nuevos horrores cometidos por el presidente Trump y su administración. https://t.co/eefL58X7R8,4623,25370.0,16,cada da parece que descubrimos nuevos horrores cometidos por el presidente trump su administracin,0.0,0.0,neutral,other
9,2020-10-21 18:36:13,Every day it seems we uncover new horrors perpetrated by President Trump and his administration. https://t.co/eefL58X7R8,14836,78136.0,16,every day seems uncover new horrors perpetrated president trump administration,0.13636363636363635,0.45454545454545453,positive,other
10,2020-10-21 17:02:00,The Build Back Better Express Tour was about more than my love for trains — it was about meeting folks along the wa… https://t.co/jead3vn38u,4518,20903.0,22,build back better express tour love trains meeting folks along wa,0.375,0.4,positive,other
11,2020-10-21 15:30:00,"Justice is on the ballot.

https://t.co/eoxT07uII9 https://t.co/0dg9Cg1f2i",4876,21919.0,7,justice ballot,0.0,0.0,neutral,other
12,2020-10-21 14:20:00,"West Virginia — in-person early voting is now open across the state. 

Make a plan to vote at https://t.co/3lR0146LYv.",3204,17403.0,17,west virginia early voting open across state make plan vote,0.05,0.4,positive,other
13,2020-10-21 14:02:00,"Missouri — today is the last day to request a mail-in ballot.

Head to https://t.co/lDI7PzhWha and request yours today.",3286,14014.0,17,missouri today last day request ballot head request today,0.0,0.06666666666666667,neutral,other
14,2020-10-21 03:20:00,It’s time we see each other as fellow Americans who live in — and love — the United States of America. https://t.co/xawem14X61,26201,111755.0,21,time see fellow americans live love united states america,0.17045454545454544,0.4916666666666667,positive,other
15,2020-10-21 00:45:00,"I’ve always believed we’re at our best when we’re one America. If we come together, there’s not a single thing we cannot overcome.",15894,126253.0,28,ive always believed best one america come together theres single thing overcome,0.5178571428571429,0.2571428571428571,positive,other
16,2020-10-20 23:50:00,"If I’m elected president, I won’t waste a minute getting this virus under control. Here’s how I’ll do it: https://t.co/NoPsQ0FDV8",12795,60826.0,24,im elected president wont waste minute getting virus control heres ill,-0.2,0.0,negative,other
17,2020-10-20 23:12:00,"Whether it’s your first time voting or you’re an old pro, voting is better with friends and family. So message a fe… https://t.co/T69jxHbVF9",3516,19528.0,24,whether first time voting youre old pro voting better friends family message fe,0.2833333333333333,0.3444444444444444,positive,other
18,2020-10-20 22:05:00,"Listening to scientists is not a bad thing.

I can’t believe that has to be said.",63358,425049.0,17,listening scientists bad thing cant believe said,0.3499999999999999,0.6666666666666666,positive,other
19,2020-10-20 20:46:00,"America is a nation that values immigrants. It is and has always been one of our greatest strengths.

We need a pre… https://t.co/k1qn4sRG3M",5202,27150.0,22,america nation values immigrants always one greatest strengths need pre,1.0,1.0,positive,other
20,2020-10-20 20:12:17,RT @KamalaHarris: My birthday wish this year? For everyone to go vote: https://t.co/MykJL0X5gt.,19358,106634.55,13,rt kamalaharris birthday wish year everyone go vote,0.0,0.0,neutral,other
21,2020-10-20 19:40:00,"A few weeks ago, I spoke to Mr. Rogers’ wife Joanne when I was in her neighborhood in Pittsburgh. It was a great co… https://t.co/tN6YnHIKFg",9847,74503.0,23,weeks ago spoke rogers wife joanne neighborhood pittsburgh great co,0.30000000000000004,0.425,positive,other
22,2020-10-20 18:59:00,"Tonight, the Avengers are assembling with real-life superhero @KamalaHarris for a grassroots fundraiser.

Time is r… https://t.co/qRbhbhGa05",3540,20179.0,15,tonight avengers assembling superhero kamalaharris grassroots fundraiser time r,0.0,0.0,neutral,other
23,2020-10-20 18:23:35,"RT @TeamJoe: When @katieporteroc breaks out her whiteboard, you know she means business.

Watch as she explains how a Biden-Harris administ…",3329,106634.55,19,rt teamjoe katieporteroc breaks whiteboard know means business watch explains administ,0.0,0.0,neutral,other
24,2020-10-20 17:45:00,"Two weeks from today, we’re going to beat President Trump.",60048,557562.0,11,two weeks today going beat president trump,0.0,0.0,neutral,other
25,2020-10-20 17:04:17,"Mr. President, the people are tired. They’re tired of your lies about this virus. They’re tired of watching more Am… https://t.co/sRiLPl7pgC",5363,31280.0,21,president people tired theyre tired lies virus theyre tired watching,-0.17500000000000004,0.6499999999999999,negative,other
26,2020-10-20 17:04:16,"Waving a white flag and saying, “it is what it is” is unacceptable when thousands are dying each week, when busines… https://t.co/sq1FRAO8w6",5888,40644.0,21,waving white flag saying unacceptable thousands dying week busines,0.0,0.0,neutral,other
27,2020-10-20 17:04:16,"Yesterday, @realDonaldTrump decided to attack Dr. Fauci once again, calling him a ‘disaster’ and public health expe… https://t.co/YefpQ9aVzu",18964,108696.0,16,yesterday realdonaldtrump decided attack fauci calling disaster public health expe,0.0,0.06666666666666667,neutral,other
28,2020-10-20 16:10:00,"Happy Birthday, @KamalaHarris. Next year, let’s celebrate with some ice cream at the White House. https://t.co/SWhS32AaIE",24715,281289.0,17,happy birthday kamalaharris next year lets celebrate ice cream white house,0.26666666666666666,0.3333333333333333,positive,other
29,2020-10-20 15:58:00,"If you live in Hawaii, Utah, or Wisconsin, in-person early voting is now underway.

Millions of Americans across th… https://t.co/ZThA9uLqvq",3047,13143.0,18,live hawaii utah wisconsin early voting underway millions americans across th,0.11818181818181818,0.4,positive,other
30,2020-10-20 15:45:00,"Maryland and New Mexico — if you plan to vote by mail, today is the last day to request your absentee ballot.

Head… https://t.co/14Xbtm0r04",3330,12678.0,22,maryland new mexico plan vote mail today last day request absentee ballot head,0.06818181818181818,0.2606060606060606,positive,other
31,2020-10-20 14:36:00,"The simple, sad truth is that this president is not in office to serve the American people. He’s in it to serve him… https://t.co/AqimMW330S",12064,62173.0,24,simple sad truth president office serve american people hes serve,-0.16666666666666666,0.4523809523809524,negative,other
32,2020-10-20 01:20:00,Pennsylvania — there are just a few hours left to register to vote online. Don’t miss your chance to make your voic… https://t.co/sh4dJTTeUg,4511,19172.0,22,pennsylvania hours left register vote online dont miss chance make voic,-0.1,0.05,negative,other
33,2020-10-20 01:05:00,"For once, Donald Trump is correct: I will listen to scientists. https://t.co/jmxoDn1Ezp",33443,216407.0,12,donald trump correct listen scientists,0.0,0.0,neutral,other
34,2020-10-20 00:44:00,I will be a president who pushes towards the future. Not one who clings to the past.,33303,347443.0,17,president pushes towards future one clings past,-0.125,0.1875,negative,other
35,2020-10-20 00:07:00,".@realDonaldTrump — if you had listened to the scientists, it wouldn't be this bad. https://t.co/0eNuV4pAMK",18179,80537.0,14,realdonaldtrump listened scientists would bad,-0.6999999999999998,0.6666666666666666,negative,other
36,2020-10-19 23:10:00,"Folks, the Avengers are coming back together for their biggest battle yet. Join them and @KamalaHarris tomorrow nig… https://t.co/5xjRpgpUAF",7515,38355.0,18,folks avengers coming back together biggest battle yet join kamalaharris tomorrow nig,0.0,0.0,neutral,other
37,2020-10-19 22:46:00,"We are in a battle for the soul of this nation — and it’s a battle we can and must win.

Vote. https://t.co/eoxT07d7QB",6376,37604.0,23,battle soul nation battle must win vote,0.8,0.4,positive,other
38,2020-10-19 20:22:07,...yes https://t.co/LZyAQugqoW,54400,479228.0,2,yes,0.0,0.0,neutral,other
39,2020-10-19 19:40:00,"Early voting starts today in:

Alaska
Arkansas
Colorado
Florida (in most counties)
Idaho (in some counties)
North D… https://t.co/EKysHgo4vn",5038,19695.0,18,early voting starts today alaska arkansas colorado florida counties idaho counties north,0.3,0.4,positive,other
40,2020-10-19 19:02:00,"This election is about so much more than policies. The soul of America is on the ballot. 

@KamalaHarris and I will… https://t.co/DVR95qQ5mc",6304,31089.0,21,election much policies soul america ballot kamalaharris,0.5,0.5,positive,election
41,2020-10-19 17:07:00,It’s long past time we build an economy that rewards work — not wealth. https://t.co/rm9AK6rBxW,5935,26305.0,15,long past time build economy rewards work wealth,-0.15,0.325,negative,other
42,2020-10-19 15:45:00,"Together, we can put an end to the last four years of darkness, division, and chaos.

We can unite, mend our wounds… https://t.co/tqnBggchIT",9163,34739.0,22,together put end last four years darkness division chaos unite mend wounds,0.0,0.06666666666666667,neutral,other
43,2020-10-19 15:25:35,RT @KamalaHarris: We the people have the power: https://t.co/MykJL0X5gt. https://t.co/5kzLNoHoBO,9782,106634.55,10,rt kamalaharris people power,0.0,0.0,neutral,other
44,2020-10-19 13:30:00,15 days. Let’s finish strong.,43397,421425.0,5,15 days lets finish strong,0.4333333333333333,0.7333333333333333,positive,other
45,2020-10-19 12:40:35,...yes https://t.co/RzZ3j3zoAL,181153,1276993.0,2,yes,0.0,0.0,neutral,other
46,2020-10-19 01:00:00,"You have the power to own the outcome of this election — but only if you vote.

Head to https://t.co/eoxT07uII9 and… https://t.co/1VLYpMa0fX",4727,22623.0,20,power outcome election vote head,0.3,1.0,positive,election
47,2020-10-19 00:00:01,Wear a mask. Wash your hands. Vote out Donald Trump.,217090,1315285.0,10,wear mask wash hands vote donald trump,0.0,0.0,neutral,other
48,2020-10-18 23:10:00,"I’ve had a rule my entire life: No matter what’s happening, no matter how important the meeting, I’ll always answer… https://t.co/mFjrG7jeIR",15338,136574.0,23,ive rule entire life matter whats happening matter important meeting ill always answer,0.2,0.8125,positive,other
49,2020-10-18 22:15:00,"We are in a battle for the soul of the nation. 

The forces of darkness, the forces of division, the forces of yest… https://t.co/28Ri8sf6AV",20600,118882.0,23,battle soul nation forces darkness forces division forces yest,0.0,0.0,neutral,other
50,2020-10-18 21:48:43,"RT @TheDemocrats: If you live in any of these states and you plan to vote by mail, your ballot must be requested by sometime this week. Fin…",2087,106634.55,26,rt thedemocrats live states plan vote mail ballot must requested sometime week fin,0.13636363636363635,0.5,positive,other
51,2020-10-18 21:35:00,I believe there is not a single thing we cannot accomplish as a country if we do it together. https://t.co/suxrTITkTm,9034,39605.0,21,believe single thing accomplish country together,0.03571428571428571,0.21428571428571427,positive,other
52,2020-10-18 21:06:00,The truth is things in life are easier when you have a plan — and that includes voting. So my team set up a tool to… https://t.co/kMRzLPAm4O,3505,15099.0,25,truth things life easier plan includes voting team set tool,0.0,0.0,neutral,other
53,2020-10-18 20:00:00,"From tackling climate change to making community college free for all — I've got big plans for the country.

And I'… https://t.co/ILqzPOdjG6",15857,90112.0,20,tackling climate change making community college free got big plans country,0.2,0.45,positive,other
54,2020-10-18 19:15:00,"I’ve spent my entire career fighting for a more just, safe, and prosperous America — and I’m not finished yet. https://t.co/cS3LPT7afX",6219,27173.0,22,ive spent entire career fighting safe prosperous america im finished yet,0.225,0.43125,positive,other
55,2020-10-18 18:30:00,"COVID-19 cases are on the rise across the nation.

But instead of leading by example, Donald Trump continues to put… https://t.co/qLJdT2e1uK",12493,59157.0,19,cases rise across nation instead leading example donald trump continues put,0.0,0.0,neutral,other
56,2020-10-18 17:34:22,"I’m in Durham, North Carolina, encouraging folks to make their plan to vote early. Tune in — and then head to… https://t.co/EF0GyybFsx",2828,12772.0,21,im durham north carolina encouraging folks make plan vote early tune head,0.1,0.3,positive,other
57,2020-10-18 17:00:00,"Folks, if you live in Illinois, today is your last day to register to vote online. Don’t wait, head to… https://t.co/GKVQfIT9IS",4502,16034.0,21,folks live illinois today last day register vote online dont wait head,0.06818181818181818,0.2833333333333333,positive,other
58,2020-10-18 16:30:00,Chip in to help us make Donald Trump a one-term president: https://t.co/JR9S8cVokb,2165,10245.0,11,chip help us make donald trump president,0.0,0.0,neutral,other
59,2020-10-18 15:08:00,Turns out Twitter isn’t so bad when you read tweets that aren’t from President Trump. https://t.co/ZKA2dwZQks,41011,183299.0,18,turns twitter isnt bad read tweets arent president trump,-0.6999999999999998,0.6666666666666666,negative,other
60,2020-10-18 14:20:00,"I often think about what it takes for a Black person to love America. That is a deep love for this country that, fo… https://t.co/SRMYLyfmvb",5389,27858.0,24,often think takes black person love america deep love country fo,0.20833333333333334,0.5083333333333333,positive,other
61,2020-10-18 00:30:00,"A job is about a lot more than a paycheck.

It's about dignity. It's about respect. It's about being able to look y… https://t.co/Szog2ai1Oc",16166,103468.0,23,job lot paycheck dignity respect able look,0.5,0.5625,positive,other
62,2020-10-17 23:15:00,Every day we're reminded just how much is at stake in this election. We can't afford to have anyone sit on the side… https://t.co/JeXE2f0m6u,4994,24765.0,23,every day reminded much stake election ca afford anyone sit side,0.2,0.2,positive,election
63,2020-10-17 22:15:00,"In the middle of a pandemic, President Trump is trying to eliminate Obamacare and increase health care costs for mi… https://t.co/u0jHcfZsx1",14912,73788.0,20,middle pandemic president trump trying eliminate obamacare increase health care costs mi,0.0,0.0,neutral,other
64,2020-10-17 21:15:00,"If we do our part, if we stand together, if we keep faith with the past and with each other — then the divisions of… https://t.co/RCopM8K5kH",10952,59897.0,24,part stand together keep faith past divisions,-0.1875,0.3125,negative,other
65,2020-10-17 19:55:00,Promise? https://t.co/Wbl86i8uYo,42927,181684.0,2,promise,0.0,0.0,neutral,other
66,2020-10-17 19:20:00,"This election is bigger than any one candidate. 

It's about the future of our economy, our health care, our climat… https://t.co/jAKGJ2mt0l",3858,18263.0,20,election bigger one candidate future economy health care climat,0.0,0.3125,neutral,election
67,2020-10-17 18:00:00,"As president, I’ll protect and build on Obamacare by:

- Giving Americans the choice to buy a new public option
- L… https://t.co/ujgavI0mVc",10072,52839.0,21,president ill protect build obamacare giving americans choice buy new public option l,0.06818181818181818,0.2606060606060606,positive,other
68,2020-10-17 16:59:00,You deserve a president who will actually tell you the truth. https://t.co/I9XzZ0ADmT,10290,42159.0,12,deserve president actually tell truth,0.0,0.1,neutral,other
69,2020-10-17 16:23:56,"RT @KamalaHarris: My mother raised me to see what could be, unburdened by what has been. https://t.co/5sNj8MmjvZ",8097,106634.55,17,rt kamalaharris mother raised see could unburdened,0.0,0.0,neutral,other
70,2020-10-17 16:15:00,Nevada — early voting has officially started. Join the over 20 million people across the country who have already v… https://t.co/i4MoC5GF1i,3315,14579.0,18,nevada early voting officially started join 20 million people across country already v,0.1,0.3,positive,other
71,2020-10-17 15:30:00,"Voting is your opportunity to be in the room where it happens.

Don't throw away your shot: https://t.co/eoxT07d7QB https://t.co/uU5mRDGsXE",18280,72346.0,19,voting opportunity room happens throw away shot,0.0,0.0,neutral,other
72,2020-10-17 14:30:00,"As the Hindu festival of Navratri begins, Jill and I send our best wishes to all those celebrating in the U.S. and… https://t.co/Ma1W5EqcnM",18226,141299.0,21,hindu festival navratri begins jill send best wishes celebrating,1.0,0.3,positive,other
73,2020-10-17 14:01:00,"We’ve got to come together to defeat Donald Trump –– Democrats, Independents, Republicans, and yes, even Demo-cats. https://t.co/LtsTWy7MmI",45657,212298.0,17,weve got come together defeat donald trump democrats independents republicans yes even,0.0,0.0,neutral,other
74,2020-10-17 00:32:00,"Folks, millions of you have already requested absentee ballots. It’s essential to return your ballots as soon as yo… https://t.co/Ktmzx8psWD",5061,18424.0,20,folks millions already requested absentee ballots essential return ballots soon yo,0.0,0.3,neutral,other
75,2020-10-16 23:54:00,Violence against transgender and gender non-conforming people — particularly Black and Brown transgender women — is… https://t.co/GSKJ6O3B1e,7481,37018.0,13,violence transgender gender people particularly black brown transgender women,-0.16666666666666666,0.43333333333333335,negative,other
76,2020-10-16 23:20:00,Let’s be clear: The emergency aid should have never been denied in the first place. https://t.co/GZuhSNSY7y,17014,93529.0,17,lets clear emergency aid never denied first place,0.17500000000000002,0.3583333333333333,positive,other
77,2020-10-16 22:26:58,"The election is underway across the country, and millions of Americans have already cast their ballots. I’m in Detr… https://t.co/kZh1mBPjCd",2345,10782.0,20,election underway across country millions americans already cast ballots im detr,0.0,0.0,neutral,election
78,2020-10-16 22:10:00,"Not only does President Trump refuse to grant Temporary Protected Status to Venezuelans, but he also apparently use… https://t.co/BaXNCIvUwg",5650,21663.0,18,president trump refuse grant temporary protected status venezuelans also apparently use,0.025,0.675,positive,other
79,2020-10-16 21:30:00,"You have the power to prevent 2016 from happening again — but only if you vote.

https://t.co/eoxT07d7QB https://t.co/ujWChoXpYK",15055,53507.0,16,power prevent 2016 happening vote,0.0,1.0,neutral,other
80,2020-10-16 20:37:00,We need a president who will expand access to health care — not one who does everything he can to tear it away.,20620,156030.0,22,need president expand access health care one everything tear away,0.0,0.0,neutral,other
81,2020-10-16 20:26:16,RT @TeamJoe: Join our Campaign Manager @jomalleydillon as she gives grassroots supporters like you an update on the state of the race: http…,717,106634.55,22,rt teamjoe join campaign manager jomalleydillon gives grassroots supporters like update state race,0.0,0.0,neutral,other
82,2020-10-16 19:34:48,We can’t let President Trump tear down Obamacare — we have to protect and build on it. Tune in as I speak live from… https://t.co/hBkQVq9w5X,3202,14079.0,24,cant let president trump tear obamacare protect build tune speak live,-0.009595959595959616,0.3944444444444445,negative,other
83,2020-10-16 17:57:00,"I know times are tough, but I promise our best days still lie ahead. Together, we're going to overcome these crises… https://t.co/SvCJYiftvo",19387,138339.0,21,know times tough promise best days still lie ahead together going overcome crises,0.3055555555555556,0.5666666666666667,positive,other
84,2020-10-16 17:11:00,The cast of Hamilton knows we're engaged in a battle for this nation's very soul — and this election is too importa… https://t.co/Ozakcs3vKc,3951,20159.0,21,cast hamilton knows engaged battle nation soul election importa,0.2,0.3,positive,election
85,2020-10-16 15:00:02,".@JLo and @AROD –– Jill and I are deeply grateful to have your support.

Thank you for stepping up and speaking out… https://t.co/lrBSRoWbE2",7927,34884.0,21,jlo arod jill deeply grateful support thank stepping speaking,0.0,0.4,neutral,other
86,2020-10-16 14:40:00,Louisiana –– early voting begins today across the state. Head to https://t.co/2NyiL42it7 to find all the info you need to cast your ballot.,3617,13726.0,22,louisiana early voting begins today across state head find info need cast ballot,0.1,0.3,positive,other
87,2020-10-16 14:20:00,Nebraska — today is your last day to register to vote online and by mail. Head to https://t.co/K5rrtCjL7O to get re… https://t.co/y45ypaqCH2,3129,12775.0,20,nebraska today last day register vote online mail head get,0.0,0.06666666666666667,neutral,other
88,2020-10-16 02:05:00,"I just stepped off the stage at tonight’s town hall, where I laid out what’s at stake in this election.

Now, I nee… https://t.co/2wbzwKXrnw",4074,23331.0,25,stepped stage tonights town hall laid whats stake election nee,0.0,0.0,neutral,election
89,2020-10-16 01:56:00,"If I'm elected president, you won't hear me race-baiting, you won't hear me dividing — you'll hear me trying to uni… https://t.co/8b6G628uFn",10466,56535.0,19,elected president wo hear wo hear dividing hear trying uni,0.0,0.0,neutral,other
90,2020-10-16 01:53:00,"How will I ensure the rights of LGBTQ+ people are protected under U.S. law?

I’ll change the law.",28416,235739.0,17,ensure rights people protected law ill change law,0.0,0.0,neutral,other
91,2020-10-16 01:42:00,We have to heal this nation. https://t.co/wD45ZGcKO2,9119,54136.0,7,heal nation,0.0,0.0,neutral,other
92,2020-10-16 01:33:00,"I'm running as a proud Democrat, but I'm going to be an American president. 

I'm going to take care of those who v… https://t.co/idzloKA0zF",23966,178208.0,23,running proud democrat going american president going take care v,0.4,0.5,positive,other
93,2020-10-16 01:29:00,"We're a diverse country — and unless we are able to treat people equally, we're just never going to meet our potential.",23217,155854.0,21,diverse country unless able treat people equally never going meet potential,0.16666666666666666,0.625,positive,other
94,2020-10-16 01:02:00,"Folks, I hope I’m making you proud during tonight’s town hall.

If you’re with us, please chip in to help power our… https://t.co/uiVZKulEXQ",4111,31523.0,25,folks hope im making proud tonights town hall youre us please chip help power,0.8,1.0,positive,other
95,2020-10-16 00:47:00,"Two of the things I've cared about throughout my whole career:

1. Improving the criminal justice system.
2. Puttin… https://t.co/009IhSNn3k",4913,29424.0,17,two things cared throughout whole career improving criminal justice system puttin,-0.1,0.47500000000000003,negative,other
96,2020-10-16 00:31:00,The words of a president matter. https://t.co/ABrbg5xTkg,6326,32729.0,7,words president matter,0.0,0.0,neutral,other
97,2020-10-16 00:20:00,"Let me be very clear: If you make under $400,000 you won’t pay a penny more in taxes under my administration.",48797,367803.0,21,let clear make wont pay penny taxes administration,0.315,0.49916666666666665,positive,other
