,create_time,text,retweets,favorites,word_tokens,text_clean,polarity,subjectivity,sentiment_2,keywords
98,2020-10-16 00:18:00,"The words of a president matter. And when a president doesn't wear a mask or makes fun of folks who do, it has consequences.",17704,121197.0,24,words president matter president wear mask makes fun folks consequences,0.3,0.2,positive,other
99,2020-10-16 00:13:00,"Over 215,000 Americans have died from COVID-19, and what is President Trump doing?

Nothing.",5996,32427.0,12,americans died president trump nothing,0.0,0.0,neutral,other
100,2020-10-16 00:11:00,"We're eight months into this pandemic, and Donald Trump still doesn't have a plan to get this virus under control.

I do.",10471,72394.0,22,eight months pandemic donald trump still plan get virus control,0.0,0.0,neutral,other
101,2020-10-15 23:47:00,"I’m about to step on stage for tonight’s town hall in Philadelphia, Pennsylvania. Tune in to @ABC to watch live.",9359,89554.0,22,im step stage tonights town hall philadelphia pennsylvania tune abc watch live,0.13636363636363635,0.5,positive,other
102,2020-10-15 23:21:00,"This is not a moment — it's a movement.

Rise up and be a part of it with the original cast of Hamilton.

Chip in t… https://t.co/tVChJhPL2p",3494,19209.0,25,moment movement rise part original cast hamilton chip,0.375,0.75,positive,other
103,2020-10-15 21:31:00,"Well, folks, @KamalaHarris and I watched some of President Trump’s remarks from the campaign trail — and it went ju… https://t.co/GUpldsPRTS",18530,102891.0,20,well folks kamalaharris watched president trumps remarks campaign trail went ju,0.0,0.0,neutral,other
104,2020-10-15 20:38:08,"Our campaign’s contact tracing remains ongoing, and my team will continue to share any significant developments wit… https://t.co/FSDfUEknvU",2675,39885.0,18,campaigns contact tracing remains ongoing team continue share significant developments wit,0.375,0.875,positive,other
105,2020-10-15 20:37:26,"Not only was the individual 50+ feet away and wearing a mask, but I was wearing an N-95 mask. No members of my staf… https://t.co/h3XGxKaz2H",2353,36791.0,22,individual feet away wearing mask wearing mask members staf,0.0,0.7,neutral,other
106,2020-10-15 20:36:44,"During our contact tracing, we discovered around noon today that a member of the company that charters my airplane… https://t.co/9POncpQDSr",7039,85807.0,19,contact tracing discovered around noon today member company charters airplane,0.0,0.0,neutral,other
107,2020-10-15 20:00:01,Donald Trump is rushing through Justice Ginsburg's replacement because he's laser-focused on destroying the Afforda… https://t.co/BJngxrJa9p,3420,13195.0,14,donald trump rushing justice ginsburg replacement destroying afforda,-0.2,0.0,negative,other
108,2020-10-15 19:15:00,President Obama and I left Donald Trump a booming economy — and he caused a recession. He squandered it just like h… https://t.co/tUhP63W2e8,49356,332959.0,21,president obama left donald trump booming economy caused recession squandered like h,0.0,0.0,neutral,other
109,2020-10-15 18:30:00,Nevada — today is the last day to register to vote online to automatically receive a ballot in the mail. Head to… https://t.co/olNDVH4jG0,2302,9163.0,21,nevada today last day register vote online automatically receive ballot mail head,0.0,0.06666666666666667,neutral,other
110,2020-10-15 18:00:00,"Donald Trump can lie about the economy all he wants, but the truth is he’s the worst jobs president since 1929. https://t.co/lShe254BEG",30934,87320.0,22,donald trump lie economy wants truth hes worst jobs president since 1929,-0.4,0.55,negative,other
111,2020-10-15 17:25:00,This #SpiritDay — and every day — we must stand up to hate and intolerance. It’s up to all of us to ensure every yo… https://t.co/w4upt7Q40N,6726,37016.0,24,spiritday every day must stand hate intolerance us ensure every yo,-0.8,0.9,negative,other
112,2020-10-15 16:48:00,Arizona — ¡la fecha límite para registrarte para votar en Arizona ha sido extendida! Visita https://t.co/nApec6sbPe… https://t.co/ccHPm6gN76,1818,8178.0,15,arizona la fecha lmite para registrarte para votar en arizona ha sido extendida visita,0.0,0.0,neutral,other
113,2020-10-15 15:52:00,Arizona — your voter registration deadline has been extended! Head to https://t.co/2fKBLS6oXu to get registered onl… https://t.co/Y4atwUGJpL,3655,12597.0,15,arizona voter registration deadline extended head get registered onl,0.0,0.0,neutral,other
114,2020-10-15 14:47:36,"RT @KamalaHarris: I will be transparent with you about any test results that I do receive. In the meantime, remember: wear a mask, practice…",6859,106634.55,23,rt kamalaharris transparent test results receive meantime remember wear mask practice,0.0,0.0,neutral,other
115,2020-10-15 14:47:34,"RT @KamalaHarris: Both the crew member and the staff member were wearing N95 masks at all points they were near me, and our doctors believe…",4222,106634.55,23,rt kamalaharris crew member staff member wearing n95 masks points near doctors believe,0.1,0.4,positive,other
116,2020-10-15 14:47:32,"RT @KamalaHarris: Late last night, I learned a non-staff flight crew member &amp; a member of my team tested positive for COVID. I wasn’t in cl…",11824,106634.55,25,rt kamalaharris late last night learned flight crew member member team tested positive covid wasnt cl,-0.024242424242424242,0.404040404040404,negative,other
117,2020-10-15 14:45:00,North Carolina –– early voting begins today across the state. Head to https://t.co/3bJfY7O8Ap for all the info you… https://t.co/HLW5lquT37,4494,18338.0,17,north carolina early voting begins today across state head info,0.1,0.3,positive,other
118,2020-10-15 13:45:00,The fact that Senate Republicans haven’t bothered to pass a COVID relief package but are rushing through President… https://t.co/9YLU18BBeT,49459,272761.0,19,fact senate republicans havent bothered pass covid relief package rushing president,0.0,0.0,neutral,other
119,2020-10-15 02:52:00,I heard it's #NationalDessertDay https://t.co/RtBhurORwR,19386,236367.0,5,heard nationaldessertday,0.0,0.0,neutral,other
120,2020-10-15 02:38:06,Nature knows. https://t.co/JNSOxAUDLu,4689,30676.0,3,nature knows,0.0,0.0,neutral,other
121,2020-10-15 02:02:00,"Folks, we can’t let up. We’re just a few hours away from our last public fundraising deadline before Election Day,… https://t.co/onlr4bpJdZ",2543,12443.0,23,folks cant let hours away last public fundraising deadline election day,-0.06666666666666667,0.07777777777777778,negative,election
122,2020-10-15 01:18:00,"To every person who chipped in a few dollars last month — thank you. Because of your support, we raised an astoundi… https://t.co/jwLLHujnJa",8708,47921.0,21,every person chipped dollars last month thank support raised astoundi,-0.1,0.08333333333333334,negative,other
123,2020-10-14 22:58:00,"Vote for America.

https://t.co/eoxT07uII9 https://t.co/sBd51fgmln",57143,177997.0,5,vote america,0.0,0.0,neutral,other
124,2020-10-14 22:30:00,"If President Trump has his way in the U.S. Supreme Court, long-term complications from COVID-19, like lung scarring… https://t.co/UD1reONgXt",18295,85706.0,15,president trump way supreme court complications like lung scarring,0.0,0.0,neutral,other
125,2020-10-14 21:40:00,"There's only one way to end this horror: Vote.

https://t.co/eoxT07uII9 https://t.co/3RTLmdyzMa",13848,51548.0,11,one way end horror vote,0.0,1.0,neutral,other
126,2020-10-14 21:15:00,Rhode Island and Tennessee — early voting has officially started. Join millions of people across the country and vo… https://t.co/BGzvhDWwNG,2960,14127.0,18,rhode island tennessee early voting officially started join millions people across country vo,0.1,0.3,positive,other
127,2020-10-14 20:37:00,Don't throw away your shot to spend Friday night with the original cast of Hamilton. Chip in today to reserve your… https://t.co/4qwgLwe1m2,3311,15978.0,21,throw away shot spend friday night original cast hamilton chip today reserve,0.375,0.75,positive,other
128,2020-10-14 19:40:00,"Today would have been George Floyd’s 47th birthday, and he should be alive to celebrate it.

I made a promise to hi… https://t.co/X46apsjz5p",28521,199686.0,22,today would george floyds 47th birthday alive celebrate made promise hi,0.1,0.4,positive,other
129,2020-10-14 18:30:00,"Tonight, our campaign will close our books and send in the names of our grassroots supporters for the final time.… https://t.co/7dCC9kXHeF",2332,10644.0,20,tonight campaign close books send names grassroots supporters final time,0.0,1.0,neutral,other
130,2020-10-14 18:01:00,Virginia — your voter registration deadline has been extended! Head to https://t.co/fnQjqg1By6 to get registered on… https://t.co/11Gizy4AEl,5275,17862.0,15,virginia voter registration deadline extended head get registered,0.0,0.0,neutral,other
131,2020-10-14 16:35:00,"Donald Trump wants to destroy Obamacare.

I want to protect and build on it.

It’s that simple, folks.",23515,168657.0,19,donald trump wants destroy obamacare want protect build simple folks,0.0,0.1523809523809524,neutral,other
132,2020-10-14 15:35:00,"If President Trump is successful in forcing through his nominee to the U.S. Supreme Court, it will likely repeal th… https://t.co/z57hZet67D",6280,22403.0,19,president trump successful forcing nominee supreme court likely repeal th,0.375,0.975,positive,other
133,2020-10-14 15:02:00,Kansas –– you can advance vote in many counties starting today. Head to https://t.co/UXWStEl2zn to find all the inf… https://t.co/QWAbZCiFER,3245,12930.0,18,kansas advance vote many counties starting today head find inf,0.25,0.3,positive,other
134,2020-10-14 14:32:00,Wisconsin — today is your last day to register to vote online or by mail. Apply online by 11:59 PM or make sure you… https://t.co/PZ1K032UDQ,5089,16571.0,22,wisconsin today last day register vote online mail apply online pm make sure,0.25,0.47777777777777775,positive,other
135,2020-10-14 13:27:00,20 days.,27214,281107.0,1,20 days,0.0,0.0,neutral,other
136,2020-10-14 01:30:00,"Thank you, Florida! https://t.co/liQYRmvY7J",18061,156973.0,4,thank florida,0.0,0.0,neutral,other
137,2020-10-14 00:45:00,I’ll be a president for all Americans. Not just the ones who vote for me.,40758,410290.0,16,ill president americans ones vote,0.0,0.0,neutral,other
138,2020-10-13 23:45:00,"Folks, it’s hard to believe, but tomorrow night marks our final public fundraising deadline of the campaign.

Can y… https://t.co/fBFPNaQrHB",2862,10904.0,20,folks hard believe tomorrow night marks final public fundraising deadline campaign,-0.09722222222222222,0.5361111111111111,negative,other
139,2020-10-13 23:16:00,Here's something that will be very different if I'm president: I'll actually listen to Dr. Fauci's advice and exper… https://t.co/usrU6r6yS1,16592,105042.0,18,something different president actually listen fauci advice exper,0.0,0.44,neutral,other
140,2020-10-13 22:45:00,"We all know President Trump has a tendency to stray from the truth, so let's set the record straight. https://t.co/hMtEkvECQR",12104,35757.0,20,know president trump tendency stray truth let set record straight,0.2,0.4,positive,other
141,2020-10-13 22:03:00,"The election is already underway.

Millions of Americans are voting. 

And they deserve to have their voices heard… https://t.co/wDxFAA7TaZ",14455,87044.0,18,election already underway millions americans voting deserve voices heard,0.0,0.0,neutral,election
142,2020-10-13 21:20:53,"With just three weeks until Election Day, I’m in Miramar, Florida, to encourage folks to make their plan to vote. T… https://t.co/udUIwjBj7F",2128,9787.0,22,three weeks election day im miramar florida encourage folks make plan vote,0.0,0.0,neutral,election
143,2020-10-13 20:15:00,"215,000 Americans have died from COVID-19 on Donald Trump’s watch. 

It’s the greatest failure of presidential lead… https://t.co/qgIVxc13Yf",25388,138695.0,17,americans died donald trumps watch greatest failure presidential lead,0.3416666666666667,0.65,positive,other
144,2020-10-13 18:57:39,"I’m in Pembroke Pines, Florida, to discuss my plans to protect and strengthen Social Security and ensure every Amer… https://t.co/vmhHUFcGMP",3028,13218.0,20,im pembroke pines florida discuss plans protect strengthen social security ensure every amer,0.03333333333333333,0.06666666666666667,positive,other
145,2020-10-13 17:46:00,"Folks, we have arrived at the final frontier of this election — and your support is more important than ever. Chip… https://t.co/8LLNfUJczU",2630,11044.0,20,folks arrived final frontier election support important ever chip,0.3,0.8333333333333334,positive,election
146,2020-10-13 17:18:00,Kentucky — in-person early voting begins today across the state. Head to https://t.co/JRj2A8zKYo and make your plan to vote.,3858,16853.0,17,kentucky early voting begins today across state head make plan vote,0.1,0.3,positive,other
147,2020-10-13 16:35:00,"If you live in:

Kansas
Louisiana
Maryland
Minnesota
New Jersey
Oregon
Virginia
Washington D.C.
West Virginia

Toda… https://t.co/zh9BUNNHOQ",9227,21790.0,16,live kansas louisiana maryland minnesota new jersey oregon virginia washington west virginia toda,0.13636363636363635,0.4772727272727273,positive,other
148,2020-10-13 16:02:00,"Texas — early voting begins today across the state.

Your voice can change the course of history — use it.

Head to… https://t.co/076ygH3oNz",10702,38872.0,20,texas early voting begins today across state voice change course history use head,0.1,0.3,positive,other
149,2020-10-13 15:30:52,"@KamalaHarris @DouglasEmhoff Happy Birthday, @DouglasEmhoff!",966,18443.0,5,kamalaharris douglasemhoff happy birthday douglasemhoff,1.0,1.0,positive,other
150,2020-10-13 14:45:00,"Donald Trump has been trying to throw out Obamacare for years.

And now he sees an opportunity to finally get it do… https://t.co/JQjceVxfUk",13421,82402.0,22,donald trump trying throw obamacare years sees opportunity finally get,0.0,1.0,neutral,other
151,2020-10-13 14:24:25,"RT @TheDemocrats: There’s a lot at stake in this election, and it’s critical you vote.

Hear from voting enthusiast President @BarackObama…",2241,106634.55,22,rt thedemocrats theres lot stake election critical vote hear voting enthusiast president barackobama,0.0,0.8,neutral,election
152,2020-10-13 13:35:00,"Three weeks from today, we’re going to make Donald Trump a one-term president.",82297,730900.0,13,three weeks today going make donald trump president,0.0,0.0,neutral,other
153,2020-10-13 01:15:00,"I am ready to fight for you and for our nation. Every day. Without exception, without reservation. And with a full and devoted heart.",22557,178627.0,24,ready fight nation every day without exception without reservation full devoted heart,0.275,0.525,positive,other
154,2020-10-13 00:15:00,We need a president who will unite our country and bring out our best — not one who stokes division and brings out our worst.,24803,189810.0,24,need president unite country bring best one stokes division brings worst,0.0,0.65,neutral,other
155,2020-10-12 23:35:00,"Folks, we're just a few days away from our final public fundraising deadline, and we need your help to hit our goal… https://t.co/NA1IufSq45",2471,9770.0,22,folks days away final public fundraising deadline need help hit goal,-0.06666666666666667,0.3888888888888889,negative,other
156,2020-10-12 23:10:00,"On National Farmers Day, we honor the hardworking men and women who drive our economy, fuel our rural communities,… https://t.co/AhdHO9ka5n",5330,28758.0,20,national farmers day honor hardworking men women drive economy fuel rural communities,0.0,0.0,neutral,other
157,2020-10-12 22:40:00,"Today marks 22 years since Matthew Shepard passed away after a brutal anti-gay hate crime. Over two decades later,… https://t.co/ZcUEuSe7Vv",25789,154513.0,18,today marks 22 years since matthew shepard passed away brutal hate crime two decades later,-0.8375,0.95,negative,other
158,2020-10-12 21:39:01,There's no question: we are neck and neck in Ohio — and with early voting underway and only 22 days until Election… https://t.co/fvt69wjGb6,3200,13258.0,20,question neck neck ohio early voting underway 22 days election,0.05,0.65,positive,election
159,2020-10-12 21:39:00,"Donald Trump is running TV ads taking Dr. Fauci out of context and without his permission.

So, here’s a message fr… https://t.co/Fo4Xz3ngJI",64151,211685.0,21,donald trump running tv ads taking fauci context without permission heres message fr,0.0,0.0,neutral,other
160,2020-10-12 21:30:33,"RT @staceyabrams: GEORGIA VOTERS: Today, 10/12, is the first day to vote early in person! Go to https://t.co/XYLW8Buumc to find a location…",1787,106634.55,20,rt staceyabrams georgia voters today first day vote early person go find location,0.1875,0.31666666666666665,positive,other
161,2020-10-12 20:04:00,"The longer Donald Trump is president, the more reckless he gets.",41592,366213.0,11,longer donald trump president reckless gets,0.5,0.5,positive,other
162,2020-10-12 18:22:00,I know Americans aren’t looking for a handout. They just want a fair chance to get ahead — and I’ll work every day… https://t.co/Zj2d80Jj6R,17480,131135.0,24,know americans arent looking handout want fair chance get ahead ill work every day,0.7,0.9,positive,other
163,2020-10-12 17:32:41,"I'm in Toledo, Ohio, to discuss my plans to build the economy back better for working families. Tune in. https://t.co/MXlsFdS3Xt",3377,16009.0,20,toledo ohio discuss plans build economy back better working families tune,0.25,0.25,positive,other
164,2020-10-12 17:22:24,RT @SnoopDogg: Listen up. It's time to vote! Go to https://t.co/0yzHjJV1f8 to find out how you can drop your ballot in the dropbox like it'…,7617,106634.55,24,rt snoopdogg listen time vote go find drop ballot dropbox like,0.0,0.0,neutral,other
165,2020-10-12 16:30:00,"Georgia — you don’t have to wait until November 3rd to cast your ballot. Early voting begins today.

Head to… https://t.co/QMeO1NxCFc",5652,22217.0,19,georgia dont wait november 3rd cast ballot early voting begins today head,0.05,0.15,positive,other
166,2020-10-12 15:56:56,RT @DrBiden: How it started:            How it's going: https://t.co/8IiIHfXCn0,28311,106634.55,9,rt drbiden started going,0.0,0.0,neutral,other
167,2020-10-12 15:41:00,"On this Indigenous People’s Day, we must both recognize the past that has brought us here, and commit to one anothe… https://t.co/lIzA886ayC",7974,38856.0,22,indigenous peoples day must recognize past brought us commit one anothe,-0.25,0.25,negative,other
168,2020-10-12 14:15:00,"Health care is deeply personal to me. And I guarantee you that if I'm elected president, I will protect your family… https://t.co/N5NMd1jInx",15515,76167.0,21,health care deeply personal guarantee elected president protect family,0.0,0.3,neutral,other
169,2020-10-12 00:30:00,"From Seneca Falls to Selma to Stonewall, we’re at our best when the promise of America is available to all.",12679,92213.0,21,seneca falls selma stonewall best promise america available,0.7,0.35,positive,other
170,2020-10-11 23:40:00,"Brayden — you have heart, courage, and maturity beyond your years. You have unlimited potential — and I can't wait… https://t.co/AR4jX30Twy",24887,132668.0,18,brayden heart courage maturity beyond years unlimited potential ca wait,0.0,1.0,neutral,other
171,2020-10-11 22:45:00,"This election, you have the power to choose:

Hope over fear.
Truth over lies.
Unity over division.

Vote. https://t.co/eoxT07uII9",11343,61187.0,19,election power choose hope fear truth lies unity division vote,0.0,0.0,neutral,election
172,2020-10-11 21:30:00,"I helped pull this country out of a recession before — and, as president, I’ll do it again.",50658,470705.0,18,helped pull country recession president ill,0.0,0.0,neutral,other
173,2020-10-11 20:30:00,"In January, I said President Trump was the worst possible leader to deal with a public health crisis. And everythin… https://t.co/ssrM90sOze",11590,42420.0,20,january said president trump worst possible leader deal public health crisis everythin,-0.3333333333333333,0.688888888888889,negative,other
174,2020-10-11 19:30:00,"When President Trump was told one thousand Americans were dying every day from COVID-19, he shrugged it off and sai… https://t.co/OnpTYrp9cx",27159,150808.0,19,president trump told one thousand americans dying every day shrugged sai,0.0,0.0,neutral,other
175,2020-10-11 17:30:00,"Today we join Polish-Americans in celebrating General Pulaski, whose heroism built the American cavalry and saved t… https://t.co/A7UJBNMSIh",6583,45939.0,16,today join celebrating general pulaski whose heroism built american cavalry saved,0.02500000000000001,0.25,positive,other
176,2020-10-11 16:50:00,"Today, let's all celebrate the one billion girls and young women around the world — and recommit to fight for their… https://t.co/QMGA2cR1Lr",13799,86225.0,20,today let celebrate one billion girls young women around world recommit fight,0.1,0.4,positive,other
177,2020-10-11 16:02:00,I want every member of the LGBTQ+ community to know you are loved and accepted just as you are — whether you've com… https://t.co/M0UaQxT1Ku,56959,323244.0,21,want every member community know loved accepted whether com,0.7,0.8,positive,other
178,2020-10-11 15:22:00,There is no excuse for President Trump’s reckless behavior. https://t.co/ooUh6pxRDt,25400,85275.0,11,excuse president trumps reckless behavior,0.025,0.05,positive,other
179,2020-10-11 00:00:00,"One in five small businesses have closed.
More than 25 million Americans are on unemployment.
Millions are at risk… https://t.co/kt3Fj7WK1W",18057,91153.0,18,one five small businesses closed 25 million americans unemployment millions risk,0.05000000000000001,0.3333333333333333,positive,other
180,2020-10-10 23:00:01,"America has to be about the possibilities of prosperity. 

Not just for the privileged few. But for the many — for all of us.",12202,81448.0,23,america possibilities prosperity privileged many us,0.15,0.3,positive,other
181,2020-10-10 21:50:00,"The fact is this pandemic has exposed the cracks in our already broken mental health care system.

We can and must… https://t.co/tGuJojkOCM",11028,64657.0,21,fact pandemic exposed cracks already broken mental health care system must,-0.25,0.30000000000000004,negative,other
182,2020-10-10 20:55:33,"I’m in Erie, Pennsylvania, to discuss my plans to build back better. Tune in. https://t.co/8NqGra1egn",3470,18134.0,16,im erie pennsylvania discuss plans build back better tune,0.25,0.25,positive,other
183,2020-10-10 20:20:00,"We're eight months into this crisis, and this president still has no plan to rebuild our economy.

I do. I'll get A… https://t.co/JEJztTk4OB",6542,29766.0,22,eight months crisis president still plan rebuild economy get,0.0,0.0,neutral,other
184,2020-10-10 19:30:00,"Let’s go vote, America.

https://t.co/eoxT07d7QB https://t.co/Nso0pXH7ER",28368,206247.0,7,lets go vote america,0.0,0.0,neutral,other
185,2020-10-10 17:45:00,We need a president who understands hardworking Americans — not one who looks down on them.,33632,290297.0,15,need president understands hardworking americans one looks,-0.15555555555555559,0.2888888888888889,negative,other
186,2020-10-10 16:48:00,"What does building back better mean for you?

- Millions of new, good-paying jobs
- A $15 federal minimum wage
- St… https://t.co/c7a7JXHSnQ",10865,56129.0,17,building back better mean millions new jobs 15 federal minimum wage st,0.08096590909090909,0.41051136363636365,positive,other
187,2020-10-10 16:04:23,"RT @HillaryClinton: It’s going great. 

If everyone joins me in giving at https://t.co/mxkpLIOEux every time they say “lock her up” or “cro…",19515,106634.55,22,rt hillaryclinton going great everyone joins giving every time say lock cro,0.8,0.75,positive,other
188,2020-10-10 15:22:00,"If you're sick, struggling, or worried about how you're going to get through the day — know you are not alone.

We'… https://t.co/7g2rajgI9W",8051,31524.0,21,sick struggling worried going get day know alone,-0.7142857142857143,0.8571428571428571,negative,other
189,2020-10-10 14:55:00,To all my fellow Delawareans — today is your last day to register to vote. Head to https://t.co/CMstw01RMW to get registered today.,4137,17083.0,21,fellow delawareans today last day register vote head get registered today,0.0,0.06666666666666667,neutral,other
190,2020-10-10 14:44:44,"RT @KamalaHarris: As a proud graduate of Howard University, I’m always excited to hear from HBCU students. We are family—no matter which sc…",8851,106634.55,22,rt kamalaharris proud graduate howard university im always excited hear hbcu students familyno matter sc,0.5875,0.875,positive,other
191,2020-10-10 13:35:00,"Over 213,000 Americans have died from this virus — and the hard truth is it didn’t have to happen this way. https://t.co/27TL7PAhCi",9036,34670.0,21,americans died virus hard truth didnt happen way,-0.2916666666666667,0.5416666666666666,negative,other
192,2020-10-10 00:20:00,"You and I can change the course of history.

Vote: https://t.co/eoxT07uII9 https://t.co/r1GFkkUkyt",8423,43473.0,12,change course history vote,0.0,0.0,neutral,other
193,2020-10-09 23:49:56,"40,000 people a day are coming down with the coronavirus. What is the matter with this guy? https://t.co/N71KynIX2k",43529,193044.0,17,people day coming coronavirus matter guy,-0.15555555555555559,0.2888888888888889,negative,other
194,2020-10-09 22:30:00,John — and farmers across the country — can’t afford four more years of a climate change denier in the White House. https://t.co/Nnv3XPdDlx,9750,43737.0,22,john farmers across country cant afford four years climate change denier white house,0.25,0.25,positive,other
